{
  "artifactType": "pxs_tm_response_envelope",
  "schemaVersion": "1.0.0",
  "response_id": "pxs-tm-res-2026-03-19-001",
  "request_id": "pxs-tm-req-2026-03-19-003",
  "handled_by": "Lyra",
  "handled_at": "2026-03-19T19:30:00Z",
  "status": "recorded_no_action",
  "canonical_target_refs": [
    {
      "kind": "evidence",
      "ref": "knowledge/evidence/2026-03/2026-03-19__task-management-tde-operator-cycle-v1.md",
      "note": "Signal recorded in current-state refresh cycle"
    }
  ],
  "validation_errors": [],
  "note": "Valid signal intake recorded; no new executable task created in this bounded cycle."
}
