{
  "artifactType": "pxs_tm_response_envelope",
  "schemaVersion": "1.0.0",
  "response_id": "pxs-tm-res-2026-03-19-010",
  "request_id": "pxs-tm-req-2026-03-19-010",
  "handled_by": "Lyra",
  "handled_at": "2026-03-19T20:33:00Z",
  "status": "accepted",
  "canonical_target_refs": [
    {
      "kind": "artifact",
      "ref": "pxs/docs/now-next-later.md#next",
      "note": "Source planning surface reviewed as valid intake origin"
    },
    {
      "kind": "artifact",
      "ref": "products/task-management/06-architecture/PXS_CONSUMPTION_INTERFACE.md",
      "note": "Semi-real pilot handled through the first executable PXS consumption contract slice"
    },
    {
      "kind": "evidence",
      "ref": "knowledge/evidence/2026-03/2026-03-19__pxs-consumption-semi-real-pilot-v1.md",
      "note": "Semi-real pilot assessment and next action recorded"
    }
  ],
  "validation_errors": [],
  "note": "Accepted as a valid work-intake request. The next smallest viable action is to convert the generic pxs priority into one bounded execution item with explicit scope and success signal."
}
