{
  "artifactType": "pxs_tm_response_envelope",
  "schemaVersion": "1.0.0",
  "response_id": "pxs-tm-res-2026-03-19-002",
  "request_id": "pxs-tm-req-2026-03-19-001",
  "handled_by": "Lyra",
  "handled_at": "2026-03-19T20:20:00Z",
  "status": "accepted",
  "canonical_target_refs": [
    {
      "kind": "artifact",
      "ref": "products/task-management/06-architecture/PXS_CONSUMPTION_INTERFACE.md",
      "note": "Executable contract slice added to the interface artifact"
    },
    {
      "kind": "evidence",
      "ref": "knowledge/evidence/2026-03/2026-03-19__pxs-consumption-contract-slice-v1.md",
      "note": "Contract-slice evidence recorded"
    },
    {
      "kind": "evidence",
      "ref": "knowledge/evidence/2026-03/2026-03-19__pxs-consumption-envelope-schemas-v1.md",
      "note": "Envelope-schema evidence recorded"
    }
  ],
  "validation_errors": [],
  "note": "Thin pilot accepted: request was structurally valid, semantically understandable, and mapped to explicit Task Management outputs without hidden thread-memory dependence."
}
