{
  "artifactType": "pxs_tm_response_envelope",
  "schemaVersion": "1.0.0",
  "response_id": "pxs-tm-res-2026-03-19-030",
  "request_id": "pxs-tm-req-2026-03-19-010",
  "handled_by": "Lyra",
  "handled_at": "2026-03-19T20:45:00Z",
  "status": "accepted",
  "canonical_target_refs": [
    {
      "kind": "artifact",
      "ref": "products/task-management/04-execution/PLAN.md",
      "note": "Bounded execution-ready next step added for the real pxs priority"
    },
    {
      "kind": "artifact",
      "ref": "pxs/docs/now-next-later.md#next",
      "note": "Source planning surface for the handled request"
    },
    {
      "kind": "evidence",
      "ref": "knowledge/evidence/2026-03/2026-03-19__pxs-consumption-real-flow-v1.md",
      "note": "Real bounded handling flow evidence"
    }
  ],
  "validation_errors": [],
  "note": "Accepted and handled through a real bounded Task Management cycle. The generic pxs priority was converted into an explicit execution-ready next step in the Task Management plan."
}
